student_id,studentName,favoriteNumber,randomParagraph
S006,Emma Watson,31,Sunshine filters through leaves creating patterns of light across the forest floor.
S007,Michael Chen,99,Technology advances rapidly transforming how people communicate and share knowledge worldwide.
S008,Sarah Johnson,14,Libraries preserve countless stories spanning centuries of human creativity and wisdom.
S009,David Martinez,67,Algorithms solve problems by breaking them into smaller manageable computational steps.
S010,Lisa Anderson,3,Oceans cover vast portions of Earth supporting diverse ecosystems and marine life.
S011,James Wilson,56,Architecture combines artistic vision with engineering principles to create functional spaces.
S012,Maria Garcia,81,Music transcends language barriers connecting people through rhythm melody and harmony.
S013,Robert Taylor,29,Scientific discovery requires careful observation experimentation and analytical reasoning skills.
S014,Jennifer Lee,45,Cities pulse with energy as millions navigate streets pursuing dreams and daily routines.
S015,William Brown,72,Photography captures fleeting moments preserving memories for future generations to treasure.
S016,Patricia Davis,11,Mathematics provides fundamental tools for understanding patterns in nature and science.
S017,Christopher White,94,Gardening teaches patience as plants grow slowly transforming seeds into beautiful flowers.
S018,Linda Rodriguez,38,Education empowers individuals to develop critical thinking and problem-solving abilities.
S019,Daniel Martinez,60,Adventure awaits those brave enough to explore unknown territories beyond comfort zones.
S020,Nancy Lopez,17,Innovation drives progress pushing boundaries of what humanity can achieve together.
S021,Thomas Gonzalez,85,Astronomy reveals mysteries of distant galaxies sparking wonder about our cosmic origins.
S022,Elizabeth Perez,26,Cooking blends science and art creating delicious experiences that bring people together.
S023,Charles Moore,50,History teaches valuable lessons about human nature and societal development over time.
S024,Barbara Jackson,8,Meditation cultivates inner peace helping minds find clarity amidst daily chaos.
S025,Steven Martin,73,Engineering solves practical problems improving quality of life through creative innovation.
S026,Susan Thompson,19,Theater brings stories alive through performance connecting audiences with powerful emotions.
S027,Joseph Harris,41,Philosophy examines fundamental questions about existence knowledge and ethical behavior.
S028,Jessica Clark,64,Ecology studies interconnected relationships between organisms and their natural environments.
S029,Paul Lewis,5,Literature explores human condition through narratives that resonate across cultural boundaries.
S030,Karen Walker,92,Statistics analyze data patterns revealing insights that guide informed decision making.
S031,Mark Hall,33,Robotics combines mechanics electronics and programming to create intelligent automated systems.
S032,Dorothy Allen,78,Psychology investigates mental processes and behaviors to understand human nature better.
S033,Donald Young,12,Chemistry examines matter composition and transformations at molecular atomic levels.
S034,Betty King,47,Dance expresses emotions through movement creating visual poetry that words cannot capture.
S035,Kenneth Wright,66,Geography maps physical features and human settlements across our dynamic planet.
S036,Helen Lopez,21,Linguistics studies language structure evolution and its role in shaping human thought.
S001,Geethika,42,The quick brown fox jumps over the lazy dog near the ancient oak tree.
S037,Matthew Hill,89,Meteorology predicts weather patterns helping communities prepare for environmental changes ahead.
S038,Deborah Scott,36,Journalism informs societies by investigating events and reporting truth to public audiences.
S039,Gary Green,54,Sports promote physical fitness teamwork and competitive spirit through athletic pursuits.
S040,Sandra Adams,9,Anthropology explores human cultures revealing diversity in customs beliefs and social structures.
S041,Anthony Baker,75,Economics analyzes resource allocation production and consumption in complex market systems.
S042,Ashley Nelson,28,Paleontology uncovers ancient life forms through fossils revealing evolutionary history secrets.
S043,Brian Carter,58,Aviation connects distant lands making global travel accessible to millions of passengers.
S044,Donna Mitchell,4,Quantum physics reveals counterintuitive behaviors of particles at subatomic scales.
S045,Kevin Roberts,83,Sociology examines social relationships institutions and patterns within human communities.
S046,Carol Turner,39,Neuroscience investigates brain function and neural pathways underlying cognition and behavior.
S047,Ryan Phillips,61,Genetics decodes hereditary information stored in DNA molecules across generations.
S048,Michelle Campbell,16,Architecture preserves cultural heritage while adapting spaces for contemporary living needs.
S049,Jason Parker,70,Renewable energy harnesses natural resources reducing environmental impact of power generation.
S050,Laura Evans,24,Cryptography secures digital communications protecting sensitive information from unauthorized access.
S051,Jacob Edwards,96,Marine biology explores ocean depths discovering species adapted to extreme underwater conditions.
S052,Amy Collins,44,Nutrition science guides healthy eating habits promoting wellness through balanced dietary choices.
S053,Nicholas Stewart,13,Artificial intelligence mimics human reasoning enabling machines to perform cognitive tasks.
S054,Debra Sanchez,52,Seismology studies earthquakes measuring tremors to understand tectonic plate movements.
S055,Timothy Morris,80,Poetry distills complex emotions into carefully crafted verses that resonate deeply.
S056,Rebecca Rogers,27,Biotechnology applies biological systems to develop innovative medical and agricultural solutions.
S057,Larry Reed,68,Archaeology excavates ancient civilizations reconstructing past lifestyles from material remains.
S058,Christine Cook,6,Fashion design blends aesthetics with functionality creating wearable art for diverse occasions.
S059,Brandon Morgan,91,Astronomy observes celestial phenomena tracking planets stars and cosmic events.
S060,Kathleen Bell,35,Urban planning designs sustainable cities balancing growth with environmental conservation needs.
S061,Aaron Murphy,57,Veterinary medicine cares for animal health applying medical knowledge across species.
S062,Heather Bailey,10,Biochemistry studies chemical processes within living organisms at cellular molecular levels.
S063,Frank Rivera,76,Political science analyzes governance systems power distribution and policy formation processes.
S064,Rachel Cooper,22,Epidemiology tracks disease patterns identifying risk factors to protect public health.
S065,Jeremy Richardson,48,Film production combines storytelling cinematography and editing into compelling visual narratives.
S066,Samantha Cox,65,Geology examines Earth structure composition and processes shaping landscapes over millennia.
S067,Peter Howard,2,Zoology classifies studies and conserves animal species across diverse habitats worldwide.
S068,Catherine Ward,86,Graphic design communicates ideas visually through typography imagery and color composition.
S069,Scott Torres,32,Astronomy investigates cosmic phenomena from formation of stars to expansion of universe.
S070,Carolyn Peterson,59,Immunology explores body defense mechanisms against pathogens and foreign substances.
S071,Eric Gray,18,Cartography creates maps representing geographic information for navigation planning purposes.
S072,Janet Ramirez,74,Acoustics studies sound properties enabling better concert halls and noise reduction systems.
S073,Samuel James,40,Botany examines plant biology ecology and classification across terrestrial aquatic environments.
S074,Diane Watson,97,Ethical hacking identifies security vulnerabilities helping organizations protect digital assets.
S075,Raymond Brooks,25,Hydrology tracks water movement distribution and quality across Earth surface and atmosphere.
S076,Janice Kelly,53,Animation brings characters alive through sequential images creating illusion of movement.
S077,Gregory Sanders,20,Forensic science applies scientific methods to criminal investigations gathering evidence.
S078,Kathryn Price,77,Astrophysics applies physics principles to understand celestial objects and cosmic phenomena.
S079,Harold Bennett,34,Entomology studies insects understanding their roles in ecosystems and agricultural systems.
S080,Virginia Wood,62,Game design creates interactive experiences blending storytelling mechanics and visual elements.
S081,Carl Barnes,1,Mineralogy identifies classifies and studies minerals examining their properties and formation.
S082,Jean Ross,87,Pathology diagnoses diseases by examining tissues cells and body fluids microscopically.
S083,Keith Henderson,30,Renewable resources provide sustainable alternatives reducing dependence on fossil fuels.
S084,Evelyn Coleman,55,Toxicology studies harmful effects of chemicals on living organisms and ecosystems.
S085,Larry Jenkins,95,Virtual reality creates immersive digital environments for entertainment education training.
S086,Brenda Perry,43,Volcanology monitors volcanic activity predicting eruptions to protect nearby communities.
S087,Willie Powell,69,Acoustical engineering designs spaces with optimal sound quality for various purposes.
S088,Andrea Long,14,Biomechanics analyzes motion forces in biological systems improving athletic performance.
S089,Jeffrey Patterson,79,Computational biology uses algorithms to analyze complex biological data patterns.
S090,Diana Hughes,37,Cryogenics studies materials at extremely low temperatures revealing unique physical properties.
S091,Bruce Flores,63,Developmental psychology examines human growth from infancy through old age stages.
S092,Martha Washington,11,Electromagnetism explains interactions between electric charges and magnetic fields.
S093,Wayne Butler,82,Food science applies chemistry and biology to processing preserving and improving foods.
S094,Judith Simmons,46,Gerontology studies aging processes helping elderly maintain health and quality of life.
S002,Suman,7,Mountains rise majestically against the horizon while eagles soar through endless skies.
S095,Arthur Foster,71,Herpetology specializes in reptiles and amphibians studying their biology and conservation.
S096,Julia Gonzales,15,Industrial design creates functional aesthetically pleasing products for consumer markets.
S097,Ralph Bryant,90,Kinesiology examines human movement mechanics optimizing physical performance and rehabilitation.
S098,Denise Alexander,23,Limnology investigates freshwater ecosystems studying lakes rivers and wetlands ecology.
S099,Roy Russell,51,Metallurgy extracts processes and studies metals developing alloys for industrial applications.
S100,Teresa Griffin,7,Nanotechnology manipulates matter at atomic scale creating materials with novel properties.
S003,Hanumantha,23,Database systems organize information efficiently allowing rapid retrieval and complex queries.
S101,Gerald Diaz,84,Oceanography explores marine environments from shallow coasts to deep trenches.
S102,Pamela Hayes,49,Paleoclimatology reconstructs ancient climates using geological and biological evidence.
S004,Doan,88,Rivers flow steadily downstream carrying nutrients to fertile valleys and coastal plains.
S103,Willie Myers,98,Quantum computing leverages quantum mechanics to perform complex calculations efficiently.
S005,Sai Vineesh,15,Programming languages enable developers to create software solutions for modern challenges.
S104,Alice Ford,16,Rheology studies flow deformation of materials under applied forces.
S105,Eugene Hamilton,60,Spectroscopy analyzes light matter interactions identifying chemical composition of substances.
